{
  "task_id": "task-generate-1",
  "task_kind": "generate_json",
  "operation": "core_owned_operation",
  "profile_slot": "operational",
  "memory_space_id": "workspace-1",
  "expires_at": "2026-08-08T12:00:00Z",
  "lease": "2026-08-08T11:05:00Z",
  "model_request": {
    "messages": [{"role": "user", "content": "opaque input"}],
    "max_output_tokens": 100,
    "response_format": "json_object"
  },
  "operation_input": {"domain": {"owned_by": "core"}}
}
